"Ready, Set, Play Children's Charity",PC Children's Charity,,0.6926571,Below Threshold
MAIN STREET CHURCH OF THE NAZARENE,Church Street Montessori,,0.69143546,Below Threshold
IGLESIA EVANGELICA HISPANA QUAKERS AMIGOS,Carmelite Missionary Sisters of St Theresa Of Child Jesus,,0.50241387,Below Threshold
"Oakwood Congregation of Jehovah's Witnesses, Toronto, Ontario",Maple Hill Baptist Church,,0.6623867,Below Threshold
Brampton Spanish Church of the Nazarene,Redeemed Christian Church of God,,0.63845336,Below Threshold
Abused Women's Resilience Centre,Ontario Network of Sexual Assault / Domestic Violence Treatment Centres,,0.65648407,Below Threshold
SILAYAN FILIPINO COMMUNITY CENTRE,Kababayan Multicultural Centre,,0.63658965,Below Threshold
SHAAREI SHOMAYIM CONGREGATION,Gan Shalom Preschool (Op: Chabad On The Avenue),,0.6389551,Below Threshold
HARVEST TIME REVIVAL,Second Harvest Food Support Committee,,0.4948905,Below Threshold
Arirang Age-Friendly Community Centre,The Pines Adult Day Centre,,0.69172156,Below Threshold
BUDDHIST DHARMALAKSANA SOCIETY OF ONTARIO,Canadian Tibetan Association of Ontario,,0.7226963,Below Threshold
BMMF/INTERNATIONAL SERVICE FELLOWSHIP,Career Foundation,,0.5174576,Below Threshold
SOLEL CONGREGATION OF MISSISSAUGA,"Mississauga, City of",,0.5926797,Below Threshold
ST. MARY'S ANTIOCHIAN ORTHODOX CHURCH (ONTARIO),St. James the Apostle Anglican Church,,0.7450546,Below Threshold
EMPOWER MINISTRIES,Community Alliance for Support and Empowerment,,0.557808,Below Threshold
SALEM MERCY MISSIONS,Redeemed Christian Church of God,,0.5549547,Below Threshold
SHALOM CHRISTIAN MINISTRIES,Rhema Christian Ministries,,0.6521837,Below Threshold
Halton Hills Christian School,Hillcrest Progressive School,,0.6756778,Below Threshold
A-Supreme Foundation,respiteservices.com,,0.40366578,Below Threshold
THE STONE CHURCH PENTECOSTAL ASSEMBLY,Redeemed Christian Church of God,,0.7250024,Below Threshold
"Scarborough Iloko Congregation of Jehovah's Witnesses, Scarborough, Ontario",Toronto Hebrew Congregation / Holy Blossom Temple Preschool,,0.59522516,Below Threshold
CANADIAN FRIENDS OF KOLLEL AMERICA AND CANADA REG'D,Albanian Canadian Association Kosova,,0.6572625,Below Threshold
River of Life Center Inc.,Credit River Medical Clinic,,0.6191158,Below Threshold
ACCESS COMMUNITY CAPITAL FUND,Community Access Learning Centre,,0.5749779,Below Threshold
BEREAN CHURCH OF GOD INTERNATIONAL - BRAMPTON,Redeemed Christian Church of God,,0.63616157,Below Threshold
COMMUNITY LIVING NEWMARKET / AURORA DISTRICT,Family Support Network Newmarket Aurora,,0.7340679,Below Threshold
Christ Church Toronto,Caribbean Canadian Catholic Centre,,0.69234455,Below Threshold
BETH EMETH BAIS YEHUDA SYNAGOGUE,Gan Shalom Preschool (Op: Chabad On The Avenue),,0.69075,Below Threshold
LANSING GOSPEL HALL,Maple Hill Baptist Church,,0.6214198,Below Threshold
THE GARDEN CLUB OF TORONTO,Friendship Circle of Toronto,,0.6852547,Below Threshold
KOREAN HYUP SHIN MISSION SOCIETY,Rainbow / Korean Information and Social Services,,0.6022917,Below Threshold
"THE CANADA EASTERN PRESBYTERY, THE KOREAN PRESBYTERIAN CHURCH ABROAD",Redeemed Christian Church of God,,0.60840476,Below Threshold
TREASURE IN THE JAR,St James Food Basket,,0.4464842,Below Threshold
YOG VEDANT SEVA SAMITI CENTRE OF CANADA,Ontario Federation of Indigenous Friendship Centres,,0.58547914,Below Threshold
Canadian Power and Sail Squadrons - Escadrilles canadiennes de plaisance,Conseil scolaire catholique MonAvenir,,0.471779,Below Threshold
HIKE ONTARIO TRUST FUND,Ontario Pension Board,,0.66961336,Below Threshold
SUMMIT COMMUNITY CHURCH,Maple Hill Baptist Church,,0.67773217,Below Threshold
Ontario Circuit 14B of Jehovah's Witnesses,Ontario Historical Society,,0.57022107,Below Threshold
LANG YI FOUNDATION,"Chinese Canadian National Council, Toronto Chapter",,0.495934,Below Threshold
"The Ukrainian Catholic Women's League of Canada, Eparchy of Toronto",Toronto and Area Council of Women,,0.6827276,Below Threshold
GRACE FELLOWSHIP CHURCH OF WEST TORONTO,Bethel Community Christian Reformed Church Share and Care,,0.70290947,Below Threshold
Weston Islamic Benevolence Society,Muslim Welfare Centre,,0.6253245,Below Threshold
Sadh Sangat Board (Nanaksar Siahar) Society Inc.,Council of Agencies Serving South Asians,,0.5419266,Below Threshold
Lay-Up Youth Basketball,Oakridge Junior Playcare,,0.42484462,Below Threshold
ARCHWAY COMMUNITY HOMES,Archway Montessori School,,0.6688831,Below Threshold
GMILAT CHESED.-ANSHEI LUBAVITCH,Chabad Lubavitch Of York Mills,,0.57724476,Below Threshold
ELIZABETH FRY SOCIETY OF SIMCOE COUNTY,Elizabeth Fry Society of Peel-Halton,,0.73012865,Below Threshold
THE TORONTO JEWISH MISSION,Arab Community Centre of Toronto,,0.67136216,Below Threshold
Kingdom Destiny Ministries,Rhema Christian Ministries,,0.5960367,Below Threshold
THE ASSEMBLIES OF YAHWEH IN CANADA SOCIETY,National Council of Jewish Women of Canada,,0.541234,Below Threshold
Shri Maha Kali Ammaa Mandir Hindu Association,Ahmdiyya Muslim Youth Association,,0.5240684,Below Threshold
BURNING BUSH MINISTRY,Redeemed Christian Church of God,,0.5041572,Below Threshold
Holiday Helpers Canada,CanadaHelps.org,,0.54881954,Below Threshold
"Eshkiniigjik Naandwechigegamig, Aabiish Gaa Binjibaaying - ENAGB Youth Program",For Youth Initiative,,0.61036384,Below Threshold
TUBEROUS SCLEROSIS CANADA SCLEROSE TUBEREUSE,Multiple Sclerosis Society of Canada. Peel-Dufferin Chapter,,0.5430794,Below Threshold
BARRIE NATIVE FRIENDSHIP CENTRE,Ontario Federation of Indigenous Friendship Centres,,0.63823843,Below Threshold
"ROYAL CANADIAN LEGION, NORTH YORK (ONTARIO NO 66) BRANCH POPPY FUND, THE",Royal Canadian Legion,,0.62950766,Below Threshold
"Rexdale Congregation of Jehovah's Witnesses, Toronto, Ontario",Toronto Hebrew Congregation / Holy Blossom Temple Preschool,,0.62861884,Below Threshold
Greater Toronto Area Ordinariate,"Toronto, City of",,0.7398931,Below Threshold
Shubh Helping Hands,Caring Hands,,0.6639663,Below Threshold
IMMANUEL WORSHIPPERS CHRISTIAN MINISTRIES,Redeemed Christian Church of God,,0.6799389,Below Threshold
Gawad Kalinga Canada,B'nai Brith Canada,,0.5006102,Below Threshold
Toronto Board of Rabbis,National Council of Jewish Women of Canada,,0.6861571,Below Threshold
BETH HAMINYAN CONGREGATION,Bethel Community Christian Reformed Church Share and Care,,0.60748273,Below Threshold
THE CHARITABLE FOUNDATION OF THE CANADIAN POLISH CONGRESS,National Congress of Italian Canadians,,0.6112014,Below Threshold
THE PASSIONIST COMMUNITY OF CANADA,Canadian Centre for Language and Cultural Studies,,0.59632564,Below Threshold
GURSIKH SABHA CANADA,B'nai Brith Canada,,0.5587821,Below Threshold
Medjugorje Centre of Canada,MCI Doctor's Office (The) - First Canadian Place,,0.6297405,Below Threshold
614 Church,Redeemed Christian Church of God,,0.65197504,Below Threshold
SCHOOL OF ISLAMIC STUDIES ONTARIO,Arab Community Centre of Toronto,,0.6596885,Below Threshold
THE BRITISH METHODIST EPISCOPAL CHURCH CONFERENCE,Calvin Presbyterian Church Community Breakfast,,0.687472,Below Threshold
THE BANTING RESEARCH FOUNDATION,Foundation for Prader-Willi Research Canada,,0.47405356,Below Threshold
CADENCE LEADERSHIP RESOURCES,Inspirations Studio,,0.44993818,Below Threshold
PEEL METHODIST CHURCH,Peel Youth Village,,0.6722728,Below Threshold
ISLAMIC CHARITABLE SERVICES SOCIETY OF CANADA,Islamic Forum of Canada Food Bank,,0.74791354,Below Threshold
National African Integration and Families Association,Black Foundation of Community Networks,,0.6301919,Below Threshold
THE EVANGELICAL FELLOWSHIP OF CANADA/ALLIANCE ï¿½VANGï¿½LIQUE DU CANADA,Redeemed Christian Church of God,,0.6791782,Below Threshold
THE CITY CHURCH OF MISSISSAUGA,"Mississauga, City of",,0.7268404,Below Threshold
Sadari Church,Redeemed Christian Church of God,,0.61991394,Below Threshold
COMMUNITY CHRISTIAN REFORMED CHURCH OF RICHMOND HILL,Maple Hill Baptist Church,,0.7492042,Below Threshold
HIGH PARK INITIATIVES,High Park Early Learning Centre,,0.7119549,Below Threshold
Visiocare International Ministries,International Medical Service,,0.49893272,Below Threshold
My Trash God's Treasure Ministries,Redeemed Christian Church of God,,0.5188503,Below Threshold
Presentation Manor for Seniors,Markhaven Home for Seniors,,0.68461555,Below Threshold
DANFORTH JEWISH CIRCLE,Gan Shalom Preschool (Op: Chabad On The Avenue),,0.58148766,Below Threshold
Spectrum Health Care Foundation,Comprehensive Healthcare Network,,0.66096747,Below Threshold
"FIFTH CHURCH OF CHRIST, SCIENTIST",Redeemed Christian Church of God,,0.57254076,Below Threshold
VICTORY BAPTIST CHURCH EAST GWILLIMBURY,East Gwillimbury. Town of,,0.6676769,Below Threshold
MAON NOAM CONGREGATION OF CANADA,Canadian Tibetan Association of Ontario,,0.6071558,Below Threshold
Ontario Circuit 3A of Jehovah's Witnesses,Law Society of Ontario,,0.55748343,Below Threshold
Canada Po Chai Temple Inc.,"Chinese Canadian National Council, Toronto Chapter",,0.53961205,Below Threshold
"THE ROYAL CANADIAN LEGION, ONTARIO PROVINCIAL COMMAND BRANCHES AND LADIES' AUXILIARIES CHARITABLE FOUNDATION",Royal Canadian Legion,,0.69163465,Below Threshold
GREGORIANA INC.,St Columba Catholic School,,0.48390418,Below Threshold
Nikibasika Development Program,Inspirations Studio,,0.42130005,Below Threshold
ZAFAR SULTAN MEMORIAL TRUST INC.,North American Muslim Foundation,,0.4869396,Below Threshold
Global River Basin Ministries,Global 180,,0.5071937,Below Threshold
Neema International Canada,ICNA Relief Canada,,0.5444796,Below Threshold
IMAM ALI ISLAMIC CENTRE,Muslim Welfare Centre,,0.7149347,Below Threshold
SEAPC (Canada),SEAS Centre,,0.6162908,Below Threshold
Social Circus Circle,ArtsCan Circle,,0.5638621,Below Threshold
World Mission Church,Redeemed Christian Church of God,,0.68845093,Below Threshold
K.A.H. FOUNDATION,Khalil Center,,0.51183724,Below Threshold
ASSEMBLY HALL OF JEHOVAH'S WITNESSES,Calvin Presbyterian Church Community Breakfast,,0.53268635,Below Threshold
K'HAL TORAS CHESED,Khalil Center,,0.6272521,Below Threshold
Global Scholars Canada,Futurpreneur Canada,,0.63685155,Below Threshold
CHRIST EXALTED MINISTRIES,Redeemed Christian Church of God,,0.69065213,Below Threshold
FATIMA HOUSE TRUST FUND,Our Lady of Fatima Child Care Centre,,0.58007395,Below Threshold
Mission 1 World,Play Island Explorers,,0.46565688,Below Threshold
Circular Innovation Council / Conseil de L'Innovation Circulaire,Centre for Social Innovation,,0.5487007,Below Threshold
Accerta Health Access Foundation,Comprehensive Healthcare Network,,0.5798466,Below Threshold
INTERNATIONAL PENTECOSTAL CITY MISSION - MISSISSAUGA BRANCH,Mount Zion Apostolic Church Mississauga Food Bank,,0.67656577,Below Threshold
One Voice One Team Youth Leadership Organization,Power Unit Youth Organization,,0.6504348,Below Threshold
GEMILAS CHESED OF CLANTON PARK,Danforth Gardens Playcare,,0.55372196,Below Threshold
Colorectal Cancer Resource & Action Network (CCRAN),Pancreatic Cancer Canada,,0.56838274,Below Threshold
KNOX PRESBYTERIAN CHURCH,Keswick United Church,,0.62667847,Below Threshold
INSTITUTE OF GURMAT STUDIES,St. Charles Garnier Before and After School Progra,,0.45768857,Below Threshold
"Mount Olive Congregation of Jehovah's Witnesses, Toronto, Ontario",Toronto Hebrew Congregation / Holy Blossom Temple Preschool,,0.6742436,Below Threshold
OORAH CHARITABLE ORGANIZATION OEUVRE DE BIENFAISANCE OORAH,Maison d'hébergement pour femmes francophones,,0.4884783,Below Threshold
Congregation Chasidei Bobov,Gan Chabad Preschool,,0.6098619,Below Threshold
BRAMALEA BAPTIST CHURCH,Bramalea Community Health Centre,,0.70120895,Below Threshold
THE LANGHAM PARTNERSHIP - CANADA,National Canadian Lawyers' Initiative,,0.58119726,Below Threshold
SANATAN MANDIR CULTURAL CENTRE,Kababayan Multicultural Centre,,0.5269973,Below Threshold
HEART LAKE BAPTIST CHURCH,Maple Hill Baptist Church,,0.6091577,Below Threshold
CANADIAN RELIGIOUS ADMINISTRATIVE SERVICES INC./SERVICES ADMINISTRATIFS RELIGIEUX CANADIENS INC.,Canadian Civil Liberties Association,,0.5307316,Below Threshold
SHAAR SHALOM SYNAGOGUE,Gan Shalom Preschool (Op: Chabad On The Avenue),,0.7260723,Below Threshold
"FIRST UNITARIAN CONGREGATION OF TORONTO,",Toronto Hebrew Congregation / Holy Blossom Temple Preschool,,0.6636716,Below Threshold
ST FRANCIS SOCIETY OF ONTARIO,Ontario Historical Society,,0.65568125,Below Threshold
Black Health Alliance,Alliance for Healthier Communities,,0.700273,Below Threshold
Shree Swaminarayan Gurukul Canada,Senior Tamils' Centre,,0.52755755,Below Threshold
Tearfund Canada,Futurpreneur Canada,,0.5377521,Below Threshold
"EMMANUEL CHURCH OF THE NAZARENE, (NORTH YORK)",Redeemed Christian Church of God,,0.72946656,Below Threshold
TORAH PUBLICATION INSTITUTE,Torah Tots South,,0.6858496,Below Threshold
MOSAIC LODGE BENEVOLENT FUND,Deep Quong Community Fund,,0.49891192,Below Threshold
COLLIER PLACE INC.,Canterbury Place Retirement Residence,,0.5122356,Below Threshold
AMIS CANADIENS DU CENTRE MEDICAL SHEBA / CANADIAN FRIENDS OF SHEBA MEDICAL CENTER,Sherbourne Health,,0.58966774,Below Threshold
"Hillcrest Congregation of Jehovah's Witnesses, Richmond Hill, Ontario",Maple Hill Baptist Church,,0.74850255,Below Threshold
Jericho Love Ministry/Le Ministere d'amour jericho,Jericho Youth Services,,0.5722911,Below Threshold
RIGHT TO LIFE ASSOCIATION OF MISSISSAUGA AND AREA,Ontario Human Rights Commission,,0.5876055,Below Threshold
Spanish Circuit 2A of Jehovah's Witnesses,Caribbean Canadian Catholic Centre,,0.48505783,Below Threshold
ST. GEORGE'S SOCIETY OF TORONTO CHARITABLE TRUST FUND,St John Ambulance - Toronto Branch,,0.58875716,Below Threshold
Elevation Church Canada (Est 2012),Mount Albert United Church,,0.5323174,Below Threshold
Punjabi Circuit 2 of Jehovah's Witnesses,The Village Shul Tots Together,,0.52430266,Below Threshold
IGLESIA HISPANA DE WOODBRIDGE,Wellmedica Woodbridge,,0.5852388,Below Threshold
THE RICHMOND HILL COUNTRY SHUL,Richmond Hill Retirement Residence,,0.71795076,Below Threshold
Redwood Park Communities Inc.,Redwood Shelter,,0.73193944,Below Threshold
"Alegria Congregation of Jehovah's Witnesses, Toronto, Ontario",Toronto Hebrew Congregation / Holy Blossom Temple Preschool,,0.60309917,Below Threshold
TOL Bible Study,Torah Tots South,,0.5450344,Below Threshold
Christ Foundation Global Assemblies,Friends of Jesus Christ,,0.70736253,Below Threshold
"Panorama Congregation of Jehovah's Witnesses, Toronto, Ontario",Toronto Hebrew Congregation / Holy Blossom Temple Preschool,,0.66735375,Below Threshold
Faizan-e-Madina Canada,B'nai Brith Canada,,0.5819906,Below Threshold
TEMPLE EMANU-EL,Temple Sinai Nursery School,,0.5795271,Below Threshold
The PepsiCo Canada Foundation,Home Depot Canada Foundation,,0.5799298,Below Threshold
AWHL-ASSAULTED WOMEN'S HELPLINE,Assaulted Women's Helpline,,0.66630566,Below Threshold
Or Hadash Synagogue,Gan Shalom Preschool (Op: Chabad On The Avenue),,0.5877471,Below Threshold
"Silver Creek Spanish Congregation of Jehovah's Witnesses, Brampton, Ontario",Toronto Hebrew Congregation / Holy Blossom Temple Preschool,,0.5853282,Below Threshold
Canadian Foundation for the Advancement of Investor Rights /Fondation canadienne pour l'avancement des droits des investisseurs,National Canadian Lawyers' Initiative,,0.46378928,Below Threshold
Mary Johnston Foundation Canada Inc.,Canadian Abilities Foundation,,0.57408595,Below Threshold
DON VALLEY BIBLE CHAPEL,Don Valley Christian Child Care,,0.7196154,Below Threshold
Chasdei Avraham Studies Institute,Eitz Chaim Schools,,0.60840106,Below Threshold
"Makom, Creative Downtown Judaism",Gan Shalom Preschool (Op: Chabad On The Avenue),,0.6054152,Below Threshold
KARTARPUR CHARITABLE FUND,Altruvest Charitable Services,,0.5562396,Below Threshold
"KING DAVID CONGREGATION OF TORONTO, EMUNAH SHLEIMAH SYNAGOGUE",Toronto Hebrew Congregation / Holy Blossom Temple Preschool,,0.7398859,Below Threshold
PORTICO COMMUNITY CHURCH,"St Bartholomew's Anglican Church, Regent Park Community Services",,0.61216056,Below Threshold
CANADIAN COAST GUARD AUXILIARY (CENTRAL & ARCTIC) INC.,Canadian Safe Boating Council,,0.574522,Below Threshold
GLOBAL 180 STUDENT COMMUNICATIONS,Global 180,,0.66224396,Below Threshold
THE REGIS JESUIT COMMUNITY,St Columba Catholic School,,0.5985834,Below Threshold
THE FATHER JUSTIN ROSARY HOUR INC.,St. Justin Martyr Before & After School Program,,0.6454663,Below Threshold
"Central French Congregation of Jehovah's Witnesses, Toronto, Ontario",Lycee Francais De Toronto,,0.6063428,Below Threshold
"BETH TZEDEC CONGREGATION,",Toronto Hebrew Congregation / Holy Blossom Temple Preschool,,0.63491815,Below Threshold
TRUST COMMUNICATIONS MINISTRIES,Social Services Network,,0.48920178,Below Threshold
International Apostolic Ministries,Redeemed Christian Church of God,,0.60848224,Below Threshold
BAYVIEW GLEN CHURCH OF THE CHRISTIAN AND MISSIONARY ALLIANCE IN CANADA,Redeemed Christian Church of God,,0.67658156,Below Threshold
Community Bible Study Canada/ Cercle Communautaire d'etude de la bible Canada,Caribbean Canadian Catholic Centre,,0.57043207,Below Threshold
Ravi Zacharias International Ministries Canada,Outward Bound Canada. Charitable Programs,,0.5449164,Below Threshold
Good Shepherd Gospel Church,Redeemed Christian Church of God,,0.7358391,Below Threshold
ST. ANDREW'S UNITED CHURCH,Mount Albert United Church,,0.7455756,Below Threshold
Conrads Kids Charitable Trust,PC Children's Charity,,0.61485136,Below Threshold
PLASP CHILD CARE SERVICES,St. Peter's Child Care Centre,,0.61286294,Below Threshold
Workplace Health Without Borders,Workplace Safety & Prevention Services,,0.6500734,Below Threshold
The Incorporated Ministry in Flemingdon Park,Lambton Park B and A School,,0.5888828,Below Threshold
"La Tour de Garde, Sociï¿½tï¿½ de Bibles et de Traitï¿½s du Quï¿½bec",Les Etoiles Brillantes - Garderie,,0.6384468,Below Threshold
HINDU SABHA,Senior Tamils' Centre,,0.5684972,Below Threshold
"Iloko West Congregation of Jehovah's Witnesses, Toronto, Ontario",Toronto Hebrew Congregation / Holy Blossom Temple Preschool,,0.65397555,Below Threshold
NEWMARKET GOSPEL HALL,Newmarket. Town Of,,0.69305104,Below Threshold
Kehillat Chaverim,Eitz Chaim Schools,,0.501546,Below Threshold
TORONTO ART THERAPY INSTITUTE,Ontario Arts Council,,0.66207695,Below Threshold
CROSS OF LIFE LUTHERAN CHURCH,Redeemed Christian Church of God,,0.69877446,Below Threshold
"Tamil West Congregation of Jehovah's Witnesses, Toronto, Ontario",Toronto Hebrew Congregation / Holy Blossom Temple Preschool,,0.62233114,Below Threshold
"Beroea Congregation of Jehovah's Witnesses, Toronto, Ontario",Toronto Hebrew Congregation / Holy Blossom Temple Preschool,,0.64492595,Below Threshold
AL-HUDA LEBANESE MUSLIM SOCIETY,Muslim Community Services,,0.6685283,Below Threshold
LANDS OF THE BIBLE ARCHAEOLOGY FOUNDATION,Redeemed Christian Church of God,,0.5013108,Below Threshold
"Donlands Congregation of Jehovah's Witnesses, Toronto, Ontario",Toronto Hebrew Congregation / Holy Blossom Temple Preschool,,0.64467514,Below Threshold
GOOD SHEPHERD COMMUNITY CHURCH SCARBOROUGH,"St Bartholomew's Anglican Church, Regent Park Community Services",,0.68679976,Below Threshold
RAJET Ameinu,Dr Ebrahim and Associates,,0.36312395,Below Threshold
TORONTO COMMUNITY MIKVAH,Arab Community Centre of Toronto,,0.71452624,Below Threshold
BEIS MEIR,The Beez Kneez,,0.43707955,Below Threshold
Missionaries of the Poor (Canada) Inc.,Church Community Volunteers,,0.6642486,Below Threshold
NEW LIFE FELLOWSHIP CHURCH,Redeemed Christian Church of God,,0.6815797,Below Threshold
HOPE AND HEALING INTERNATIONAL,Our Place Community of Hope Centre,,0.59777653,Below Threshold
West Edge Community Church,Mount Albert United Church,,0.6500024,Below Threshold
SHAAREI ZION COMMUNITY CENTRE,Gan Shalom Preschool (Op: Chabad On The Avenue),,0.68508625,Below Threshold
"Scarborough Creole Congregation of Jehovah's Witnesses, Toronto, Ontario",Toronto Hebrew Congregation / Holy Blossom Temple Preschool,,0.6327963,Below Threshold
FIRST NARAYEVER CONGREGATION,Redeemed Christian Church of God,,0.54340696,Below Threshold
Clarkson Community Church,Maple Hill Baptist Church,,0.69227004,Below Threshold
ENCOUNTER COVENANT CHURCH,Redeemed Christian Church of God,,0.7174414,Below Threshold
The Seminary of the Christian Community in North America,Redeemed Christian Church of God,,0.6823623,Below Threshold
OPTIONS MISSISSAUGA PRINT AND OFFICE SERVICES,Options Mississauga,,0.71237767,Below Threshold
THE JESUIT FATHERS OF UPPER CANADA,Caribbean Canadian Catholic Centre,,0.60873806,Below Threshold
Peel Family Mediation Services,Ontario Association for Family Mediation,,0.7288872,Below Threshold
Feet Forward Organization,Good Foot Delivery,,0.54973984,Below Threshold
THE PALIN FOUNDATION,Terry Fox Foundation,,0.4611491,Below Threshold
ST. ANDREW'S PRESBYTERIAN CHURCH,St. James the Apostle Anglican Church,,0.717214,Below Threshold
Breakaway Relief Foundation,Breakaway Addiction Services,,0.5872003,Below Threshold
NORTHSIDE BIBLE CHAPEL,Maple Hill Baptist Church,,0.656212,Below Threshold
Compassionlight Institute,Peaceful Hearts Georgina Foundation,,0.66866636,Below Threshold
ASSEMBLEE EVANGELIQUE PENTECOSTALE,Redeemed Christian Church of God,,0.68882793,Below Threshold
Face the Future Foundation,Promised Future Inc.,,0.6640893,Below Threshold
In2One Community Church of the Christian and Missionary Alliance in Canada,Redeemed Christian Church of God,,0.72473305,Below Threshold
"Mount Pleasant Congregation of Jehovah's Witnesses, Brampton, Ontario",Maple Hill Baptist Church,,0.65699685,Below Threshold
Generous Space Ministries,Altruvest Charitable Services,,0.52580297,Below Threshold
DEFENCE FOR CHILDREN INTERNATIONAL-CANADA (ANGLOPHONE SECTION),Canadian Centre for Language and Cultural Studies,,0.5843554,Below Threshold
TORONTO YOUTH FOR CHRIST,Toronto Hebrew Congregation / Holy Blossom Temple Preschool,,0.6458317,Below Threshold
YONGE-ROSEDALE CHARITABLE FOUNDATION,Peaceful Hearts Georgina Foundation,,0.5048273,Below Threshold
TEMPLE HAR ZION,Temple Sinai Nursery School,,0.60439056,Below Threshold
No Other Than Jesus Christ,Friends of Jesus Christ,,0.4706669,Below Threshold
THE TORONTO SPIRITUAL LIFE CONVENTION,Spirit of Life,,0.60451615,Below Threshold
SOCIETY OF ST. JOHN THE EVANGELIST IN CANADA INC.,St. James the Apostle Anglican Church,,0.6580557,Below Threshold
AMF MINISTRIES CANADA,Canada. Canada Revenue Agency,,0.5453385,Below Threshold
CANADIAN CAMPUS EVANGELICAL fellowship inc.,Redeemed Christian Church of God,,0.6384063,Below Threshold
The Iveron Icon of the Mother of God Georgian Catholic-Apostolic Authocephalous Orthodox Church,St. James the Apostle Anglican Church,,0.58808625,Below Threshold
JESUIT FATHERS LOURDES PARISH TORONTO,Caribbean Canadian Catholic Centre,,0.5956416,Below Threshold
THE CHURCH OF THE NAZARENE IN ONTARIO,Redeemed Christian Church of God,,0.71624863,Below Threshold
ORGANIZATION FOR ISLAMIC LEARNING,Ahmdiyya Muslim Youth Association,,0.697806,Below Threshold
TIMOTHY EATON MEMORIAL CHURCH,Maple Hill Baptist Church,,0.61665535,Below Threshold
SMILE Canada- Support Services,All Smiles Childcare Centre,,0.54626125,Below Threshold
TORONTO CHINESE CHRISTIAN PARENTING ASSOCIATION,"Chinese Canadian National Council, Toronto Chapter",,0.71022594,Below Threshold
"Mount Dennis Congregation of Jehovah's Witnesses, Toronto, Ontario",Toronto Hebrew Congregation / Holy Blossom Temple Preschool,,0.68060374,Below Threshold
Chinese Circuit 2A of Jehovah's Witnesses,"Chinese Canadian National Council, Toronto Chapter",,0.5405905,Below Threshold
AHMADIYYA MUSLIM JAMA'AT CANADA INC.,North American Muslim Foundation,,0.7034092,Below Threshold
Newmarket Church of the Nazarene,St. James the Apostle Anglican Church,,0.73597527,Below Threshold
"Bloomington Spanish Congregation of Jehovah's Witnesses, Aurora, Ontario",Toronto Hebrew Congregation / Holy Blossom Temple Preschool,,0.56105083,Below Threshold
Feeding Canadian Kids Society,Children's Aid Foundation of Canada,,0.665665,Below Threshold
PARTNERS INTERNATIONAL-CHRISTIAN NATIONALS EVANGELISM MISSION,Redeemed Christian Church of God,,0.580746,Below Threshold
St. Michael the Archangel Anglican Church of Canada,St. James the Apostle Anglican Church,,0.7180731,Below Threshold
HOCKEY HELPS THE HOMELESS/HOCKEY AIDE LES SANS-ABRI,Volunteer Toronto,,0.45851082,Below Threshold
2769905 Canada Centre,New Canadian Community Centre,,0.7039699,Below Threshold
KEHILLAT SHAAREI TORAH OF TORONTO,Toronto Hebrew Congregation / Holy Blossom Temple Preschool,,0.66268194,Below Threshold
Faith Tabernacle Deliverance Centre,Redeemed Christian Church of God,,0.7356945,Below Threshold
CHOSEN PEOPLE MINISTRIES (CANADA),Community Outreach Canada - Second Chance,,0.56745696,Below Threshold
CHOSEN PEOPLE MINISTRIES AND BETH SAR SHALOM MISSION FOUNDATION,Bethel Community Christian Reformed Church Share and Care,,0.5888591,Below Threshold
NORTH AMERICAN ATHIA SATPANTH SAMAJ OF TORONTO INCORPORATED,South Asian Legal Clinic of Ontario,,0.5148028,Below Threshold
Toronto Thiruchendur Murugan Temple,Toronto Community and Culture Centre,,0.553164,Below Threshold
ISTHMUS: BECAUSE HUNGER DOESN'T TAKE WEEKENDS OFF / ISTHME: PARCE QUE LA FAIM NE PREND PAS DE CONGï¿½,Garderie Les Merveilles Du Monde,,0.46698344,Below Threshold
The Canadian Jesuit Missions,Caribbean Canadian Catholic Centre,,0.6714009,Below Threshold
The City Shul Congregation,Gan Shalom Preschool (Op: Chabad On The Avenue),,0.6611407,Below Threshold
Every Day Ministries Canada,Holy Family Daycare,,0.5147196,Below Threshold
"HOLY CROSS PRIORY, THE ORDER OF THE HOLY CROSS",St. James the Apostle Anglican Church,,0.7178061,Below Threshold
THE ORDER MINOR CONVENTUALS OF ONTARIO,Carmelite Missionary Sisters of St Theresa Of Child Jesus,,0.64157355,Below Threshold
JESUIT CENTRE FOR SOCIAL FAITH AND JUSTICE,Caribbean Canadian Catholic Centre,,0.5739415,Below Threshold
