Sri Sathya Sai Baba Centre of Middlefield,Charlton First Base Centre,,0.43663067,Below Threshold
BRAMPTON/MISSISSAUGA AND DISTRICT LABOUR COUNCIL INJURED WORKERS MONUMENT INCORPORATED,Greater Toronto Area Injured Worker Resource Centre,,0.59869933,Below Threshold
SOCIETY OF ST VINCENT DE PAUL ST PIUS X CONFERENCE IN TORONT,Blessed Pier Giorgio Frassati Extended Day Program,,0.5639237,Below Threshold
FOCOLARE MOVEMENT (WOMEN'S BRANCH),Canadian Voice of Women for Peace,,0.58630556,Below Threshold
BLACKHEAD WESTERN BAY PASTORAL CHARGE,Bayview Glen,,0.4753837,Below Threshold
THE MYSTICAL ORDER OF ST. MARY SPIRITUAL CHURCH,Carmelite Missionary Sisters of St Theresa Of Child Jesus,,0.67646253,Below Threshold
LOGOS APOSTOLIC CHURCH OF RECONCILIATION,Redeemed Christian Church of God,,0.74083066,Below Threshold
Freedom Global Outreach,Human Rights Legal Support Centre,,0.5084496,Below Threshold
Charismatic Episcopal Church of Asia,Redeemed Christian Church of God,,0.6182215,Below Threshold
Society of Saint Vincent de Paul - St Teresa Conference,Society of St Vincent de Paul.[Newmarket / East Gwillimbury Region],,0.6503196,Below Threshold
METRO BIBLE COLLEGE INC.,Liberty Preparatory School,,0.6259526,Below Threshold
CHILDREN'S INTERNATIONAL SUMMER VILLAGES (CANADA) METROPOLITAN TORONTO CHAPTER,Children's Resource and Consultation Centre of Ontario,,0.69675887,Below Threshold
Refire Ministries,Rhema Christian Ministries,,0.62065125,Below Threshold
TRUE HOLINESS APOSTOLIC TEMPLE OF TORONTO,Redeemed Christian Church of God,,0.67465246,Below Threshold
KINGDOM OF GLORY MINISTRY,Redeemed Christian Church of God,,0.6826395,Below Threshold
Maha Rudra Dev Mandir and Cultural Sabha Inc.,Vedic Roots Montessori Academy,,0.540733,Below Threshold
SRI SRI SRI SHIVABALAYOGI PARVATTAMA MEDITATION FELLOWSHIP OF CANADA,"Vasantham, A Tamil Wellness Centre",,0.60007375,Below Threshold
"BRAMPTON BRAMALEA CHRISTIAN FELLOWSHIP, INC.",Brampton Life Centre,,0.66329235,Below Threshold
CHURCH OF ST. JUDE NORTH BRAMALEA,St. James the Apostle Anglican Church,,0.6402553,Below Threshold
Toronto Nigerian Seventh-Day Adventist Church,Seventh-Day Adventist Church,,0.7180543,Below Threshold
WOODBRIDGE SEVENTH-DAY ADVENTIST CHURCH,Seventh-Day Adventist Church,,0.72504437,Below Threshold
SOCIETY OF ST VINCENT DE PAUL ST JOHN'S CONFERENCE,Society of St Vincent de Paul.[Newmarket / East Gwillimbury Region],,0.66836613,Below Threshold
SOCIETY OF ST-VINCENT DE PAUL-TORONTO EAST PARTICULAR COUNCIL,Society of St Vincent de Paul.[Newmarket / East Gwillimbury Region],,0.56554544,Below Threshold
Yehyang Korean Presbyterian Church,Cummer Avenue United Church and Taiwanese United Church,,0.65072894,Below Threshold
ACHILLES TRACK CLUB OF CANADA,Ontario Track 3 Ski Association for the Disabled,,0.50436985,Below Threshold
CJF MINISTRIES CANADA,Canada. Canada Revenue Agency,,0.5724205,Below Threshold
HERITAGE BAPTIST CHURCH OF BARRIE ONTARIO,Maple Hill Baptist Church,,0.6826889,Below Threshold
KINGDOM GLORY MINISTRIES,Redeemed Christian Church of God,,0.64472914,Below Threshold
Sant Shree Dyaneshwar Gurukul Of Canada Foundation,PKD Foundation of Canada,,0.56344867,Below Threshold
CORNER STONE CHURCH OF GOD,Redeemed Christian Church of God,,0.6990133,Below Threshold
Universal Assembly of God,Redeemed Christian Church of God,,0.53539276,Below Threshold
Grace Church in Scarborough,Mount Albert United Church,,0.7074736,Below Threshold
House of Prayer World Evangelism.,Redeemed Christian Church of God,,0.70131284,Below Threshold
CHRISTIAN MISSIONS IN MANY LANDS (CANADA) INC.,Redeemed Christian Church of God,,0.66293836,Below Threshold
GracePoint Baptist Church,Maple Hill Baptist Church,,0.70117533,Below Threshold
God's Solution Ministries,Christian Horizons Employment Services,,0.54588383,Below Threshold
Nav Durga Hindu Centre,Senior Tamils' Centre,,0.5264313,Below Threshold
THE HOLY MOUNTAIN PRESBYTERIAN CHURCH OF TORONTO,Maple Hill Baptist Church,,0.69217014,Below Threshold
Zion Faith Hill Tabernacle,Maple Hill Baptist Church,,0.6963459,Below Threshold
ROTARY CLUB OF TORONTO EGLINTON CHARITABLE FOUNDATION,Toronto Humane Society,,0.62061286,Below Threshold
THE LITTLE METIS PRESBYTERIAN CHURCH,"Métis Nation of Ontario, Brampton - Credit River",,0.6318109,Below Threshold
Socio-Economic and Environmental Development Solutions (SEEDS),Green Communities Canada,,0.4605453,Below Threshold
G.I.F.T.S. Foundation,Altruvest Charitable Services,,0.55579543,Below Threshold
FAITH IMPACT MINISTRY INC.,Beach Interfaith Outreach Program,,0.59584403,Below Threshold
Servants of the Immaculate Heart of Mary - Fathers,Carmelite Missionary Sisters of St Theresa Of Child Jesus,,0.70211434,Below Threshold
WE Church,Redeemed Christian Church of God,,0.70681775,Below Threshold
Life Eternal Asian Fellowship of Canada,"Chinese Canadian National Council, Toronto Chapter",,0.6266449,Below Threshold
NEW COVENANT CHURCH (NCC),Redeemed Christian Church of God,,0.74015665,Below Threshold
GREGORY T GRAHAM FOUNDATION,GSH Medical,,0.46272147,Below Threshold
Iglesia Pentecostal Hispana De Brampton,Caribbean Canadian Catholic Centre,,0.60710573,Below Threshold
EAST YORK CHINESE ALLIANCE CHURCH OF THE CHRISTIAN AND MISSIONARY ALLIANCE IN CANADA,Federation of Chinese Canadians In Markham,,0.7316772,Below Threshold
FLEMINGDON PARK PARENT ASSOCIATION (FPPA),Flemingdon Park Community Food Bank,,0.5735569,Below Threshold
VAUGHAN BAPTIST CHURCH,Maple Hill Baptist Church,,0.7127606,Below Threshold
"CANADIAN HELLENIC ORTHODOX MISSIONARY FRATERNITY OF TORONTO APOSTLE PAUL"" INC""",Friends of Jesus Christ,,0.62763274,Below Threshold
Sierra Leone Muslim Jamaat of Toronto,Arab Community Centre of Toronto,,0.71871376,Below Threshold
PETAH TIKVA - ANSHE CASTILLA CONGREGATION,Children's Circle Of St Barnabas,,0.5599821,Below Threshold
TORONTO CHRISTS CONGREGATION,Toronto Hebrew Congregation / Holy Blossom Temple Preschool,,0.6887095,Below Threshold
BETHESDA CHRISTIAN RESIDENTIAL CARE INC.,Ebenezer United Church [Child Care],,0.6556392,Below Threshold
NEW BEGINNINGS MINISTRIES INC.,Redeemed Christian Church of God,,0.6585995,Below Threshold
ANBA KIRILLOS SOCIETY FOR SENIORS,Mount Albert Friendship Club for Seniors,,0.5438221,Below Threshold
NORTH TORONTO CHINESE ALLIANCE CHURCH,Cummer Avenue United Church and Taiwanese United Church,,0.7412454,Below Threshold
CHRISTIAN AID & RELATIONAL EVANGELISM INCORPORATED,Redeemed Christian Church of God,,0.6060456,Below Threshold
ANGLICAN WORSHIP RESOURCES SOCIETY,St. James the Apostle Anglican Church,,0.72202563,Below Threshold
CHRIST EVANGELICAL LUTHERAN CHURCH,Redeemed Christian Church of God,,0.7163607,Below Threshold
Vellore Ludhiana Committee of Canada,Canada. Members of Parliament,,0.5793489,Below Threshold
Friends of the Museums of Mississauga,"Mississauga, City of",,0.7407328,Below Threshold
Catch The Fire Toronto East,City of Toronto,,0.6877927,Below Threshold
Thornhill Lutheran Church,Maple Hill Baptist Church,,0.69851077,Below Threshold
THE TORONTO EVANGELISTIC ASSOCIATION,Redeemed Christian Church of God,,0.6277322,Below Threshold
CHURCH OF THE FIRST BORN APOSTOLIC INC.,Redeemed Christian Church of God,,0.7372149,Below Threshold
DEVXCHANGE INTERNATIONAL PROGRAMS,Outward Bound Canada,,0.41055435,Below Threshold
HUMBERVALE UNITED CHURCH,Village of Humber Heights,,0.7281952,Below Threshold
FORSHANG SECT INTERNATIONAL DA-YUAN ASSOCIATION (CANADA) INC,Federation of Chinese Canadians In Markham,,0.59481025,Below Threshold
BLOOMING FOREST BHIKKHUNI BUDDHIST ASSOCIATION,Shoresh's Kavanah Garden,,0.5740057,Below Threshold
MOUNT CALVARY APOSTOLIC CHURCH OF ONTARIO,Mount Albert United Church,,0.7213513,Below Threshold
MILLIKEN GOSPEL CHURCH,Maple Hill Baptist Church,,0.6398254,Below Threshold
Jeja Korean Presbyterian Church,Cummer Avenue United Church and Taiwanese United Church,,0.55235374,Below Threshold
CHINESE COORDINATION CENTRE OF WORLD EVANGELISM (CANADA),"Chinese Canadian National Council, Toronto Chapter",,0.6876267,Below Threshold
"SPARROW LAKE UNITED CHURCH CAMP, INC.",Christ Church Deer Park Community Breakfast,,0.590945,Below Threshold
MYRTLE MARTIN MEMORIAL FOUNDATION,Peaceful Hearts Georgina Foundation,,0.49604428,Below Threshold
The Small Wonders Charitable Organization,Altruvest Charitable Services,,0.5679784,Below Threshold
Om Sharavanabhava Seva Foundation of Canada,Kidney Foundation of Canada (The),,0.5479163,Below Threshold
IMAM MAHDI ISLAMIC CENTRE INC.,Muslim Welfare Centre,,0.7033238,Below Threshold
SOCIETY OF ST VINCENT DE PAUL- MERCIFUL REDEEMER CONFERENCE,Redeemed Christian Church of God,,0.653469,Below Threshold
TRUST UNDER THE WILL OF THE ESTATE OF VLADIMIR CHARLES PATTERSON,Ontario. Ministry of the Attorney General. Office of the Public Guardian and Trustee,,0.43539435,Below Threshold
TORONTO CHRISTIAN ALLIANCE CHURCH,Caribbean Canadian Catholic Centre,,0.69541365,Below Threshold
Freedom Worship Centre,"Westminster Chapel at High Park Outreach Ministries, Food and Clothing Bank",,0.63980335,Below Threshold
ALL SAINTS CHURCH KINGSWAY,Mount Albert United Church,,0.6597675,Below Threshold
MAHAMEVNA BHAVANA ASAPUWA TORONTO,B'nai Brith Canada,,0.5697062,Below Threshold
CHRISTIAN BAPTIST CHURCH NEWMARKET,Mount Albert United Church,,0.665058,Below Threshold
SOLOMON MINISTRY,Redeemed Christian Church of God,,0.48780757,Below Threshold
GRACE PRESBYTERIAN CHURCH,Grace Church Day Care Centre,,0.70680463,Below Threshold
Heartspeak,Grateful Hearts,,0.457066,Below Threshold
GOSPEL ASSEMBLY CHURCH ASSOCIATION,Redeemed Christian Church of God,,0.68462324,Below Threshold
The Hope First Nations Church,Our Place Community of Hope Centre,,0.7369358,Below Threshold
Centre for Islamic Knowledge (CIK),Muslim Welfare Centre,,0.62264466,Below Threshold
CATHOLIC MARRIAGE TRIBUNAL,Custody Review Board,,0.47563136,Below Threshold
Outreach Zanzibar Foundation,Beach Interfaith Outreach Program,,0.55487126,Below Threshold
BARRIE CHURCH OF CHRIST,Mount Albert United Church,,0.6558386,Below Threshold
VERBO COMMUNITY CHURCH OF MISSISSAUGA,Caribbean Canadian Catholic Centre,,0.6361339,Below Threshold
"WINDERMERE UNITED CHURCH,",Windermere Kids,,0.70830846,Below Threshold
Nasrul-Lahi-L-Fatih Society Peel Region (NASFAT Peel Region),Peel Region,,0.58640486,Below Threshold
Victory In Jesus Church,Redeemed Christian Church of God,,0.72541153,Below Threshold
Saint Maximos and Saint Domadios Coptic Orthodox Church,Sts Peter and Paul Residence,,0.63135904,Below Threshold
"WESLEY UNITED CHURCH,",Mount Albert United Church,,0.7054734,Below Threshold
Fuller Life Church,Redeemed Christian Church of God,,0.5801761,Below Threshold
THE WOODBRIDGE PENTECOSTAL CHURCH,Redeemed Christian Church of God,,0.6942704,Below Threshold
ST JOHN'S CHURCH,St. James the Apostle Anglican Church,,0.7213088,Below Threshold
Society of St. Vincent de Paul - Immaculate Heart of Mary Conference,Carmelite Missionary Sisters of St Theresa Of Child Jesus,,0.64672154,Below Threshold
WESTVIEW PRESBYTERIAN CHURCH,Maple Hill Baptist Church,,0.6760954,Below Threshold
L'ASSEMBLEE NOUVELLE ALLIANCE,Garderie Du Soleil Levant,,0.49334168,Below Threshold
RIVERDRIVE PARK BIBLE CHAPEL,Maple Hill Baptist Church,,0.6439431,Below Threshold
THE EAST YORK FOUNDATION,East York Medical Health Centre,,0.6693973,Below Threshold
LIGHT & LIFE MINISTRIES PENTECOSTAL CHURCH OF GOD,Redeemed Christian Church of God,,0.67271006,Below Threshold
CHUNG WAH TAO TEH BENEVOLENT ASSOCIATION,Yee Hong Centre for Geriatric Care,,0.5209242,Below Threshold
SOCIETY OF ST VINCENT DE PAUL OUR LADY QUEEN OF THE WORLD CONFERENCE,Society of St Vincent de Paul.[Newmarket / East Gwillimbury Region],,0.6253594,Below Threshold
COVENANT CHRISTIAN REFORMED CHURCH OF BARRIE,Redeemed Christian Church of God,,0.6822946,Below Threshold
"Christian Science Society, Scarborough",Christian Horizons Simcoe,,0.5263256,Below Threshold
JERRAHI SUFI ORDER OF CANADA,Islamic Forum of Canada Food Bank,,0.5268551,Below Threshold
St. Mark's Parish,St. James the Apostle Anglican Church,,0.6465206,Below Threshold
SOCIETY OF SAINT VINCENT DE PAUL SAINT CECILIA'S CONFERENCE,Society of St Vincent de Paul.[Newmarket / East Gwillimbury Region],,0.6446092,Below Threshold
DONWAY BAPTIST CHURCH,Maple Hill Baptist Church,,0.6811791,Below Threshold
Scarborough Family Christian Church (SFCC),Caribbean Canadian Catholic Centre,,0.6365161,Below Threshold
Chofetz Chaim Heritage Society of Canada,First Portuguese Canadian Cultural Centre of Toronto,,0.5917564,Below Threshold
Ohr Torah,Torah Tots South,,0.6828207,Below Threshold
THE GEORGE S. SYME SENIORS' CENTRE OF YORK,Regional Geriatric Program of Toronto,,0.6664697,Below Threshold
Catch The Fire Mississauga,"Mississauga, City of",,0.7338296,Below Threshold
CANADIAN FRIENDS OF DENTAL VOLUNTEERS FOR ISRAEL,Ontario Dental Association,,0.6351172,Below Threshold
FIRE PROOF WORSHIP CENTER INC.,Redeemed Christian Church of God,,0.5846834,Below Threshold
Scarborough Chinese Bible Church,Cummer Avenue United Church and Taiwanese United Church,,0.6662699,Below Threshold
CAMP AWAKENING INCORPORATED,Ontario Camps Association,,0.5885621,Below Threshold
THE PEOPLE BRIDGE CHARITABLE FOUNDATION,BridgeWay Family Centre,,0.59268063,Below Threshold
Markham Inter-Church Committee for Affordable Housing,Toronto Community Housing,,0.7234245,Below Threshold
Hope Of Believers Ministry,Redeemed Christian Church of God,,0.67618054,Below Threshold
CORNERSTONE BAPTIST CHURCH,Cornerstone Medical Clinic,,0.6822468,Below Threshold
reStart,Fresh Start Cleaning and Maintenance,,0.5668129,Below Threshold
JOHN STEWART (HOME) ESTATE FOUNDATION,MacDonald House - Retirement Home,,0.5006962,Below Threshold
DEER PARK UNITED CHURCH,Christ Church Deer Park Community Breakfast,,0.74603915,Below Threshold
The Voice of Resurrection and Life Ministry,Redeemed Christian Church of God,,0.66816884,Below Threshold
Shalom To The Nations Church / Eglise Shalom Pour Les Nations,Mon Petit Univers,,0.538969,Below Threshold
TRUST UNDER THE WILL OF WILFRED G CROZIER ESTATE,Ontario. Ministry of the Attorney General. Office of the Public Guardian and Trustee,,0.42049956,Below Threshold
The Gospel Faith Mission International (TGFMI),Redeemed Christian Church of God,,0.60323226,Below Threshold
Assemblea Cristiana Pentecostale Italiana,Redeemed Christian Church of God,,0.6314012,Below Threshold
Christ Supreme Ministry,Redeemed Christian Church of God,,0.71715534,Below Threshold
Christlikeness Apostolic Church,Redeemed Christian Church of God,,0.7171222,Below Threshold
RUTH CHURCH,Redeemed Christian Church of God,,0.60784626,Below Threshold
Glorious Women of Wonders Prayer Ministry,Carmelite Missionary Sisters of St Theresa Of Child Jesus,,0.61990535,Below Threshold
Romanian Baptist Church of Toronto Inc.,Caribbean Canadian Catholic Centre,,0.6591284,Below Threshold
The Church in Mississauga,"Mississauga, City of",,0.71674645,Below Threshold
The Churchwardens of the Church of Trinity-St. Paul in Port Credit,St. James the Apostle Anglican Church,,0.72018224,Below Threshold
STONE BRIDGE BAPTIST CHURCH,Maple Hill Baptist Church,,0.6719209,Below Threshold
GLAD TIDINGS TABERNACLE (ASSEMBLY),Calvin Presbyterian Church Community Breakfast,,0.61286426,Below Threshold
THE PRESBYTERIAN CHURCH IN CANADA,Redeemed Christian Church of God,,0.686568,Below Threshold
C3 Church 416 Inc,Redeemed Christian Church of God,,0.5973115,Below Threshold
Youth Converts Initiative Inc.,For Youth Initiative,,0.7399583,Below Threshold
TABERNACULO EVANGELICO DEL NAZARENO CHURCH OF THE NAZARENE,Redeemed Christian Church of God,,0.6749804,Below Threshold
LIAT BENEVOLENT SERVICES OF CANADA INC.,Ontario Caregiver Organization,,0.59905374,Below Threshold
BRAMPTON EVANGELICAL MISSIONARY CHURCH,Brampton Life Centre,,0.7175052,Below Threshold
REMNANT TABERNACLE,Redeemed Christian Church of God,,0.5804013,Below Threshold
Bethel Fellowship Trust Canada Inc.,Bethel Community Christian Reformed Church Share and Care,,0.69473505,Below Threshold
SOCIETY OF ST. VINCENT DE PAUL BLESSED SACRAMENT CONFERENCE,St. James the Apostle Anglican Church,,0.67150235,Below Threshold
MOTHER OF MERCY CENTER,Mother Of Compassion Child Care,,0.716643,Below Threshold
PRAY WITHOUT CEASING MINISTRIES INT'L. INC.,Redeemed Christian Church of God,,0.59654826,Below Threshold
HARVEST FIELDS MINISTRIES,Second Harvest Food Support Committee,,0.5951119,Below Threshold
YAVNEH ZION CONGREGATION,Torah Tots Nursery,,0.6448377,Below Threshold
Centro Familiar De Adoracion Family Worship Centre,Holy Family Daycare,,0.67288053,Below Threshold
CHRISTIAN LEADERSHIP COUNCIL OF DOWNTOWN TORONTO,Redeemed Christian Church of God,,0.6315005,Below Threshold
WALTON PLACE (SCARBOROUGH) INC,East Scarborough Storefront,,0.620255,Below Threshold
Paola Ipanaque International Ministries,Pape Medical Centre,,0.5522547,Below Threshold
Voice of the Last Days Ministry,Redeemed Christian Church of God,,0.54875064,Below Threshold
FALLINGBROOK PRESBYTERIAN CHURCH,Maple Hill Baptist Church,,0.6192045,Below Threshold
Toronto Accessible Sports Council,Toronto Sport Leadership Program,,0.73778677,Below Threshold
Sarvaam Foundation Canada,Moksha Canada Foundation,,0.5340235,Below Threshold
MORE THAN CHILD'S PLAY,More Than Child's Play EarlyON Child and Family Centre,,0.6897564,Below Threshold
The Zahra(s) Trust Canada,Islamic Forum of Canada Food Bank,,0.5783369,Below Threshold
CANADIAN FOUNDATION FOR INFECTIOUS DISEASES-LA FONDATION CANADIENNE DES MALADIES INFECTIEUSES,Canadian Liver Foundation,,0.46621192,Below Threshold
"UNITED APOSTOLIC ASSEMBLY, (TORONTO) CHURCH",Redeemed Christian Church of God,,0.70107675,Below Threshold
"WESTWAY UNITED CHURCH,",Westway Christian Church Food Bank,,0.6730628,Below Threshold
HALLELUJAH INSPIRATIONAL MINISTRIES,Voices of Joy Community Choir,,0.63141274,Below Threshold
DAVENPORT-PERTH COMMUNITY CHURCH,Mount Albert United Church,,0.61640996,Below Threshold
LEASIDE PRESBYTERIAN CHURCH,Leaside Retirement Residence,,0.73791325,Below Threshold
ST. BARNABAS' CHURCH,St. James the Apostle Anglican Church,,0.74406654,Below Threshold
"TRINITY UNITED CHURCH,",Redeemed Christian Church of God,,0.6977708,Below Threshold
ST. DIMITAR BULGARIAN EASTERN ORTHODOX CHURCH,Our Lady of Smolensk,,0.54967755,Below Threshold
Prayer Stone Peoples Church,Redeemed Christian Church of God,,0.6871766,Below Threshold
World Student Christian Federation - Canada / Fï¿½dï¿½ration universelle des associations chrï¿½tiennes d'ï¿½tudiants - Canada,University of Toronto Students' Union,,0.5860591,Below Threshold
Doctors for Doctors & Nurses for Nurses Society,Nurse Practitioners' Association of Ontario,,0.70373,Below Threshold
Creating Hopes Canada,Canadian Abilities Foundation,,0.63051975,Below Threshold
SHILOH APOSTOLIC CHURCH INC,Redeemed Christian Church of God,,0.6220491,Below Threshold
LIGHTHOUSE DEAF FELLOWSHIP,Canadian Cultural Society of the Deaf,,0.68035,Below Threshold
MARKHAM PASTORAL CHARGE,Markham East,,0.6292597,Below Threshold
The Lion of Judah Spiritual Baptist Old School Church,Redeemed Christian Church of God,,0.74114764,Below Threshold
POWER OF LOVE MINISTRY INC,Rhema Christian Ministries,,0.56829774,Below Threshold
PARKWAY BIBLE CHURCH,Maple Hill Baptist Church,,0.7095994,Below Threshold
Lamb of God Fellowship,Friends of Jesus Christ,,0.69327986,Below Threshold
GEORGETOWN BREAD BASKET,St James Food Basket,,0.60488284,Below Threshold
VERITY CENTRE FOR BETTER LIVING INC.,Tendercare Living Centre,,0.59934187,Below Threshold
THE KOREAN BETHEL EVANGELICAL CHURCH,Redeemed Christian Church of God,,0.67273283,Below Threshold
THE EVANGELICAL MISSION OF CANADA,Redeemed Christian Church of God,,0.7369368,Below Threshold
International Bible Christian Church,Redeemed Christian Church of God,,0.7341136,Below Threshold
"THE CHURCH OF GOD (SABBATH-KEEPING), SCARBOROUGH",Redeemed Christian Church of God,,0.63598156,Below Threshold
YORK REGION ISLAMIC CENTRE,Muslim Welfare Centre,,0.66844237,Below Threshold
PRISON FELLOWSHIP OF CANADA / FRATERNITE DES PRISONS DU CANADA,"Canada. Correctional Service Canada, Central Ontario District",,0.60138285,Below Threshold
Gospel of Fire Ministries Canada,Redeemed Christian Church of God,,0.6406106,Below Threshold
AL-EMAN SOCIETY OF CANADA,Canadian Addison Society (The),,0.56652904,Below Threshold
World Mission Society Church of God,Redeemed Christian Church of God,,0.74273366,Below Threshold
Guardian Angels Parish,St Michael And All Angels Day Care Centre,,0.64209294,Below Threshold
PRAISE TEMPLE OF CHRIST INTERNATIONAL,Redeemed Christian Church of God,,0.7407304,Below Threshold
Eslah Islamic Association,Ahmdiyya Muslim Youth Association,,0.6818868,Below Threshold
RICHVIEW UNITED CHURCH,Maple Hill Baptist Church,,0.67743874,Below Threshold
THE SOCIETY OF SAINT VINCENT DE PAUL - PEEL NORTH PARTICULAR COUNCIL,Society of St Vincent de Paul.[Newmarket / East Gwillimbury Region],,0.73513687,Below Threshold
CHURCH OF ST. THEODORE OF CANTERBURY,St. James the Apostle Anglican Church,,0.7428236,Below Threshold
SCARBOROUGH FILIPINO SEVENTH-DAY ADVENTIST CHURCH,Mount Zion Filipino Seventh-Day Adventist Church Food Bank,,0.67874336,Below Threshold
Toronto Lifespring Christian Fellowship,Friendship Circle of Toronto,,0.64153564,Below Threshold
"Society of Saint Vincent de Paul - St. Jerome Conference, Brampton",Society of St Vincent de Paul.[Newmarket / East Gwillimbury Region],,0.624195,Below Threshold
Villages of Hope: Africa Society,Our Place Community of Hope Centre,,0.69548523,Below Threshold
ANJUMAN-E-KANEEZAN-E-ZAHRA INC,ANIDA Food Bank,,0.48278117,Below Threshold
ASIAN OUTREACH INTERNATIONAL (CANADA),"Chinese Canadian National Council, Toronto Chapter",,0.7347115,Below Threshold
The Carr Street Gospel Church,Maple Hill Baptist Church,,0.7189946,Below Threshold
PAOC MISSION LINK,Pape Medical Centre,,0.5595336,Below Threshold
Muslim Neighbour Nexus,Muslim Welfare Centre,,0.6419324,Below Threshold
Abundant Life Evangelical Missionary Church,Redeemed Christian Church of God,,0.664872,Below Threshold
THE CHURCH OF GOD OF PROPHECY ONTARIO CANADA ETOBICOKE,Redeemed Christian Church of God,,0.68556374,Below Threshold
Filipino Christian Fellowship,Friends of Jesus Christ,,0.62477964,Below Threshold
PROVIDENCE CEMETERY,Providence Healthcare,,0.61268544,Below Threshold
SABAD VARTARA INTERNATIONAL (CANADA) INC.,Canadian Standards Association (CSA) Group,,0.43835425,Below Threshold
SOCIETY FOR CATHOLIC LIFE AND CULTURE,Caribbean Canadian Catholic Centre,,0.5400655,Below Threshold
Toronto Onsesang Presbyterian Church,Toronto Hebrew Congregation / Holy Blossom Temple Preschool,,0.6455611,Below Threshold
CHURCH OF THE TRANSFIGURATION,Redeemed Christian Church of God,,0.7380438,Below Threshold
METRO CHINESE CHRISTIAN MISSION,Cummer Avenue United Church and Taiwanese United Church,,0.63563275,Below Threshold
IBVM FOUNDATION OF CANADA INC.,Toronto ABI Network,,0.5746939,Below Threshold
ISLAMIC SOCIETY OF PEEL,Muslim Community Services,,0.659405,Below Threshold
TRUE WORD APOSTOLIC CHURCH OF JESUS CHRIST,Redeemed Christian Church of God,,0.67057335,Below Threshold
Gilda's Club Simcoe Muskoka,Lake Simcoe Conservation Foundation,,0.51629347,Below Threshold
Birthright of Vaughan,Vaughan. City of,,0.61967087,Below Threshold
KINGDOM OF JEHOVAH RAPHA MINISTRY,Redeemed Christian Church of God,,0.5727345,Below Threshold
TORONTO DIOCESAN ANGLICAN CHURCH WOMEN,Toronto and Area Council of Women,,0.71588254,Below Threshold
Legion of Mary - Toronto Senatus,Royal Canadian Legion,,0.6313436,Below Threshold
ST. JAMES COURT NON-PROFIT APARTMENTS CORPORATION,Options for Homes Non-Profit Corporation,,0.60260534,Below Threshold
KEELE STREET CHRISTIAN CHURCH,Keswick Christian Church,,0.7089458,Below Threshold
ST JOHN'S CHURCH WEST TORONTO,St. James the Apostle Anglican Church,,0.6762035,Below Threshold
METANOIA COMMUNITY FOUNDATION,Meta Centre for the Developmentally Disabled,,0.50577044,Below Threshold
SOCIETY OF ST VINCENT DE PAUL OUR LADY OF FATIMA CONFERENCE,Carmelite Missionary Sisters of St Theresa Of Child Jesus,,0.647796,Below Threshold
JAPANESE GOSPEL CHURCH OF TORONTO,Cummer Avenue United Church and Taiwanese United Church,,0.63565785,Below Threshold
NORTH RUNNYMEDE UNITED CHURCH,Mount Albert United Church,,0.6655177,Below Threshold
Bethanias Baptist Church,Redeemed Christian Church of God,,0.708026,Below Threshold
ALPHA-OMEGA CHRISTIAN MINISTRIES,AlphaPlus,,0.559543,Below Threshold
LAMBSGATE TORONTO CHURCH,St. James the Apostle Anglican Church,,0.65713733,Below Threshold
HOLY TRINITY MACEDONO BULGARIAN EASTERN ORTHODOX CHURCH,St. James the Apostle Anglican Church,,0.6308277,Below Threshold
THE KOREAN BEACON CHURCH,Redeemed Christian Church of God,,0.6752497,Below Threshold
UNITARIAN CONGREGATION IN MISSISSAUGA,Toronto Hebrew Congregation / Holy Blossom Temple Preschool,,0.6359867,Below Threshold
Credit Valley Conservation Authority,Credit Valley Health Center,,0.69963026,Below Threshold
Living Hope Family Church,Bethel Community Christian Reformed Church Share and Care,,0.6988305,Below Threshold
Les Terebinthes de la Justice,In Search of Justice,,0.63998604,Below Threshold
"RENEWAL FELLOWSHIP WITHIN THE PRESBYTERIAN CHURCH IN CANADA, THE",Redeemed Christian Church of God,,0.6895281,Below Threshold
Celebration Church Barrie,"St Bartholomew's Anglican Church, Regent Park Community Services",,0.5502163,Below Threshold
ROCK AND RIVER CONGREGATION,Redeemed Christian Church of God,,0.5207341,Below Threshold
St. Mary Immaculate Parish,St. Mary Immaculate Before & After School Program,,0.69175637,Below Threshold
SPIRITANS THE CONGREGATION OF THE HOLY GHOST,Holy Spirit School Age Program,,0.63161916,Below Threshold
DOUGLAS GOW TRUST,"Aykler Management, Non-Profit",,0.43943924,Below Threshold
Wasaga Beach Jewish Centre,Beach Interfaith Outreach Program,,0.56726146,Below Threshold
Oakville Chinese Evangelical Missionary Church,Cummer Avenue United Church and Taiwanese United Church,,0.63968045,Below Threshold
