Toronto River of Life Christian Church,Caribbean Canadian Catholic Centre,,0.5960609,Below Threshold
APOSTOLIC CHRISTIAN CHURCH (NAZAREAN),Redeemed Christian Church of God,,0.6942915,Below Threshold
Divine Favour 7th Day Ministries Inc.,Redeemed Christian Church of God,,0.64088047,Below Threshold
ST. FRANCIS OF ASSISI PARISH,St. Agnes of Assisi Child Care,,0.684739,Below Threshold
Lithuanian Martyrs Parish,St. James the Apostle Anglican Church,,0.5119697,Below Threshold
St. Ignatius Loyola Parish,St. Paul's Catholic Elementary School,,0.64827514,Below Threshold
St. Ambrose Parish,St. James the Apostle Anglican Church,,0.6525698,Below Threshold
MUSLIM ASSOCIATION OF BRANTFORD,Arab Community Centre of Toronto,,0.68051624,Below Threshold
Thornhill Torah Educational Centre,Thornhill Montessori Learning Centre,,0.7324021,Below Threshold
PAROISSE SACRE-COEUR,Conseil scolaire Viamonde,,0.67627466,Below Threshold
SILOAM KOREAN EVANGELICAL CHURCH,Keswick Christian Church,,0.5591513,Below Threshold
Great Multitude Presbyterian Church of Woodbridge,Mount Albert United Church,,0.61401594,Below Threshold
PENTECOSTAL MISSIONARY CHURCH OF CHRIST (4TH WATCH) ONTARIO INC.,Redeemed Christian Church of God,,0.7005063,Below Threshold
COMMUNITY CHRISTIAN REFORMED CHURCH OF MEADOWVALE,Meadowvale East Apostolic Church Food Bank,,0.72001195,Below Threshold
ST. FRANCIS XAVIER PARISH,St. Paul's Catholic Elementary School,,0.68899214,Below Threshold
WORLD ASSOCIATION FOR CHRISTIAN COMMUNICATION,Friends of Jesus Christ,,0.61296153,Below Threshold
REVEALED WORD BELIEVERS ASSEMBLY,Seventh-Day Adventist Church,,0.6191708,Below Threshold
ASIA MISSION CENTER INTERNATIONAL,Council of Agencies Serving South Asians,,0.56158715,Below Threshold
WORD FOR THE WORLD INTERNATIONAL MINISTRIES,World Education Services,,0.50267136,Below Threshold
GLENCAIRN BAPTIST CHURCH,Maple Hill Baptist Church,,0.70906615,Below Threshold
THE SANDBOX PROJECT CHARITY,Sandbox Day Care Centre,,0.59605247,Below Threshold
St. Lawrence Martyr Parish,St. James the Apostle Anglican Church,,0.70050853,Below Threshold
"ANCOP INTERNATIONAL (CANADA), INC.",AIESEC Canada,,0.5605839,Below Threshold
GRACE TABERNACLE,Grace Church Day Care Centre,,0.6561878,Below Threshold
St. Andrew Kim's Parish,St. James the Apostle Anglican Church,,0.6970147,Below Threshold
THE GOOD NEIGHBOURS' CLUB,Good Neighbour Project,,0.6707692,Below Threshold
SAINT MARK'S ORTHODOX FELLOWSHIP (CANADA) INC.,St. James the Apostle Anglican Church,,0.6444473,Below Threshold
TORONTO SERVICE BATTALION CAPITAL FUND,Canada. Veterans Affairs Canada [Toronto area],,0.62653613,Below Threshold
The Chassidus Learning Centre of Thornhill,Thornhill Montessori Learning Centre,,0.73685884,Below Threshold
SACRED HEART OF JESUS PARISH - YE SU SUNG SHIM PARISH,Cummer Avenue United Church and Taiwanese United Church,,0.6700684,Below Threshold
North-Valley Islamic Centre,Muslim Welfare Centre,,0.6274223,Below Threshold
MAYFIELD UNITED CHURCH (MAYFIELD PASTORAL CHARGE),Mayfield Medical Centre,,0.56496865,Below Threshold
Vision X Ministries,Vision Youth,,0.6209393,Below Threshold
N I F CANADIAN CHARITABLE TRUST,Canadian Abilities Foundation,,0.66333246,Below Threshold
International Fellowship of Christians and Jews of Canada,National Council of Jewish Women of Canada,,0.7130282,Below Threshold
TORONTO SOMANG KOREAN PRESBYTERIAN CHURCH,Cummer Avenue United Church and Taiwanese United Church,,0.62161124,Below Threshold
Annunciation of the Blessed Virgin Mary Parish,St. James the Apostle Anglican Church,,0.6769736,Below Threshold
INTERNATIONAL SOCIETY FOR KRISHNA CONSCIOUSNESS (BRAMPTON),Brampton Life Centre,,0.5217614,Below Threshold
WESTMINSTER UNITED CHURCH,Mount Albert United Church,,0.7017479,Below Threshold
Danforth Islamic Centre,Danforth Medical Centre,,0.70546436,Below Threshold
WINGS AS EAGLES MINISTRIES,Inner City Angels,,0.56004953,Below Threshold
ST. AUGUSTINE OF CANTERBURY PARISH,St. James the Apostle Anglican Church,,0.6703878,Below Threshold
UNITED ISRAEL APPEAL OF CANADA INC,National Council of Jewish Women of Canada,,0.6483574,Below Threshold
Portraits in Faith,Christian Horizons Simcoe,,0.56203157,Below Threshold
Heaven Living Ministries Inc.,Redeemed Christian Church of God,,0.6264214,Below Threshold
HUNGARIAN EVANGELICAL LUTHERAN CHURCH OF OUR REDEEMER,Redeemed Christian Church of God,,0.6931068,Below Threshold
Dail Community of Canada,Ontario Community Newspapers Association,,0.6758618,Below Threshold
THE IEMELIF CHURCH OF CANADA,Redeemed Christian Church of God,,0.66330135,Below Threshold
HAROLD AND GRACE BAKER CENTRE,Harold and Grace Baker Long Term Care,,0.64961934,Below Threshold
CACGST -Canadian Association of China Graduate School of Theology,"Chinese Canadian National Council, Toronto Chapter",,0.59256846,Below Threshold
SPANISH BAPTIST CHURCH,Redeemed Christian Church of God,,0.6536579,Below Threshold
NEW HOPE COMMUNITY CHURCH,Redeemed Christian Church of God,,0.7070985,Below Threshold
NEW JERUSALEM FELLOWSHIP TABERNACLE,Redeemed Christian Church of God,,0.66306466,Below Threshold
CHINESE IMMIGRANTS EMERGENCY RELIEF,Chinese and Southeast Asian Legal Clinic,,0.57034576,Below Threshold
LOCUST HILL UNITED CHURCH,Maple Hill Baptist Church,,0.68924284,Below Threshold
WORLD OF HINDUISM SABHA (TORONTO),Toronto Community and Culture Centre,,0.5566723,Below Threshold
Hope Ambassadors to Africa,Olive Branch of Hope (The),,0.5371921,Below Threshold
GLORY OF ZION,Mount Sinai Fertility,,0.49217927,Below Threshold
Faith in God Ministries,Redeemed Christian Church of God,,0.6598666,Below Threshold
Berhan Semay Church of Toronto,Keswick Christian Church,,0.6003045,Below Threshold
Nueva Vida Iglesia Comunitaria,Casa Doña Juana,,0.6266327,Below Threshold
ANJUMAN-E-FAKHRI (MISSISSAUGA),Chinese Association of Mississauga,,0.5402491,Below Threshold
Recreation Youth and Young Adults Inc.,For Youth Initiative,,0.6470402,Below Threshold
Iglesia La Arbolada,Casa Doña Juana,,0.6198143,Below Threshold
Celestial Church of Christ Olajuwon Parish,Redeemed Christian Church of God,,0.71484077,Below Threshold
HUMANE MEDICINE INC.,Noble Medical Clinic,,0.55169785,Below Threshold
DOWN SYNDROME FAMILY SUPPORT ASSOCIATION OF CANADA,Down Syndrome Association of York Region,,0.7463682,Below Threshold
"PERFORMING ARTS LODGES, TORONTO (PAL TORONTO)",Toronto Community and Culture Centre,,0.6557635,Below Threshold
MISSISSAUGA CHRISTIAN RENEWAL CENTRE,Mississauga Medical Centre,,0.7156811,Below Threshold
THE EAST TORONTO EVANGELICAL LUTHERAN LATVIAN CHURCH,St. James the Apostle Anglican Church,,0.6116216,Below Threshold
OVERCOMERS CHRISTIAN FELLOWSHIP (TORONTO),Redeemed Christian Church of God,,0.62208784,Below Threshold
Canada Full Gospel World Mission Inc.,Caribbean Canadian Catholic Centre,,0.67143536,Below Threshold
WORD OF LIFE WORLD OUTREACH MINISTRIES (SCARBOROUGH),Beach Interfaith Outreach Program,,0.59696716,Below Threshold
THE CHURCH OF GOD OF PROPHECY ONTARIO CANADA MISSISSAUGA,Redeemed Christian Church of God,,0.68752176,Below Threshold
ST DEMETRIUS CHURCH,St. James the Apostle Anglican Church,,0.6937171,Below Threshold
THE COUNCIL OF KOREAN-CANADIAN CHURCH MUSIC,Cummer Avenue United Church and Taiwanese United Church,,0.524168,Below Threshold
4Grow,Greensaver,,0.55323464,Below Threshold
ST. BARNABAS PARISH,St. James the Apostle Anglican Church,,0.65678084,Below Threshold
Yoga Without Borders,Centre for Mindfulness Studies,,0.42890137,Below Threshold
CANADIAN FRIENDS OF KOLLEL TIFERES YITZCHOK OF ALEKSANDER,Albanian Canadian Association Kosova,,0.57559615,Below Threshold
DON VALLEY REACT INC,Don Valley Community Legal Services,,0.5913445,Below Threshold
VISHVA ADHYATMIK SANGH INC,Senior Tamils' Centre,,0.5334829,Below Threshold
CENTRO DONNE INC.,Centro Abruzzo / Villa Charities,,0.5205433,Below Threshold
Christian hope Ministry International,Our Place Community of Hope Centre,,0.64863473,Below Threshold
Metamorphosis Greek Orthodox Church of Toronto,Redeemed Christian Church of God,,0.67965174,Below Threshold
Y.M.C.A. PROPERTIES INCORPORATED,Trinity Glen Housing Corporation,,0.5761403,Below Threshold
The Ramp Church Toronto,Caribbean Canadian Catholic Centre,,0.60862494,Below Threshold
UNION PRESBYTERIAN CHURCH,Unionville Montessori School Church,,0.7088092,Below Threshold
HOLY ZION OF MELCHIZEDEK (TORONTO) INC.,Toronto Hebrew Congregation / Holy Blossom Temple Preschool,,0.6221421,Below Threshold
TORONTO METROPOLITAN CATHOLIC CAMPUS MINISTRY,Caribbean Canadian Catholic Centre,,0.7218559,Below Threshold
KA KWONG BENEVOLENT SOCIETY,Yee Hong Centre for Geriatric Care,,0.53659457,Below Threshold
MISSISSAUGA VICTORY CHURCH INC.,Mount Zion Apostolic Church Mississauga Food Bank,,0.6612251,Below Threshold
Happy Korean Presbyterian Church,Cummer Avenue United Church and Taiwanese United Church,,0.60046864,Below Threshold
PEOPLE'S WORSHIP CENTRE,Christians Day Care Centre,,0.65866256,Below Threshold
North York Islamic Community Center,Arab Community Centre of Toronto,,0.6906686,Below Threshold
ORFUND FOUNDATION,Canadian Orthopaedic Foundation,,0.5822808,Below Threshold
Toronto Dojang Jeungsando,UJA Federation of Greater Toronto,,0.4764843,Below Threshold
Full Gospel Hungarian Mission,Redeemed Christian Church of God,,0.569373,Below Threshold
SALT AND LIGHT CATHOLIC MEDIA FOUNDATION,National NewsMedia Council,,0.5276152,Below Threshold
GUYANESE PIONEER FUND-RAISING GROUP,2-Spirited People of the 1st Nations,,0.44897592,Below Threshold
TORONTO BUDDHIST CHURCH,Toronto Hebrew Congregation / Holy Blossom Temple Preschool,,0.65092146,Below Threshold
SOLID ROCK CHRISTIAN ASSEMBLY,Redeemed Christian Church of God,,0.5502112,Below Threshold
Atisha Buddhist Centre,South Asian Welcome Centre,,0.54380083,Below Threshold
MOUNT ZION HOUSE OF PRAISE,Mount Albert United Church,,0.6640518,Below Threshold
CORPORATE COUNSELLING AND CHAPLAINCY INC.,Redeemed Christian Church of God,,0.5277963,Below Threshold
Shining Light Korean Church,Redeemed Christian Church of God,,0.6134643,Below Threshold
Teamwork Children's Services International,Creating Together Child and Family Centre,,0.599222,Below Threshold
Palbok Methodist Church,Maple Hill Baptist Church,,0.59268713,Below Threshold
The Queen's York Rangers Regimental Council,York Regional Police,,0.49859446,Below Threshold
SLOVENIAN APOSTOLIC CIRCLE (TORONTO),Cypriot Community of Toronto,,0.7065522,Below Threshold
SOKA GAKKAI INTERNATIONAL ASSOCIATION OF CANADA/ASSOCIATION DE LA SOKA GAKKAI INTERNATIONALE DU CANADA,Canadian Centre for Language and Cultural Studies,,0.5582005,Below Threshold
IONA (WILLOWDALE) PRESBYTERIAN CHURCH,Willowdale Manor,,0.72937167,Below Threshold
REFUGE DELIVERANCE MINISTRIES INTERNATIONAL INC.,Redeemed Christian Church of God,,0.6493585,Below Threshold
MOUNT SINAI HOSPITAL DEPARTMENT OF MEDICINE RESEARCH FUND,Mount Sinai Hospital,,0.7364527,Below Threshold
Ar-Rahman Islamic Organization,Ahmdiyya Muslim Youth Association,,0.6272447,Below Threshold
THE GLOBAL VILLAGE PRESBYTERIAN CHURCH,Redeemed Christian Church of God,,0.6892561,Below Threshold
EARNEST CHARITABLE FOUNDATION,Altruvest Charitable Services,,0.6031798,Below Threshold
M.P. CHARITABLE FOUNDATION,Altruvest Charitable Services,,0.5207374,Below Threshold
The Church in City of Markham,Markham. City of,,0.7287712,Below Threshold
Emerging Generation,Next Gen Men,,0.58749145,Below Threshold
Limmud FSU Canada,Futurpreneur Canada,,0.56005895,Below Threshold
AFRICAN LEADERSHIP MISSION,Black Foundation of Community Networks,,0.5034566,Below Threshold
"RUNNYMEDE PRESBYTERIAN CHURCH,",Runnymede Healthcare Centre,,0.67861277,Below Threshold
SEICHO-NO-IE CANADA,Make-A-Wish Canada,,0.5189524,Below Threshold
INTERNATIONAL MIRACLE MISSION INC.,International Medical Service,,0.5768535,Below Threshold
St. Mary of the Angels Parish,Carmelite Missionary Sisters of St Theresa Of Child Jesus,,0.64799666,Below Threshold
Croatian Martyrs Parish,St. James the Apostle Anglican Church,,0.49816418,Below Threshold
Kunphen Buddhist Centre,Centre for Mindfulness Studies,,0.5147681,Below Threshold
CANADIAN FRIENDS OF AKIM - ISRAEL ASSOCIATION FOR THE MENTALLY HANDICAPPED,National Council of Jewish Women of Canada,,0.63853496,Below Threshold
Veterans Helping Veterans,Tony Stacey Centre for Veterans Care,,0.58857334,Below Threshold
Our Lady of the Assumption Parish,Our Lady of Annunciation Catholic School Mobile,,0.6909454,Below Threshold
CONGREGATION DARCHEI NOAM RECONSTRUCTIONIST SYNAGOGUE OF TORONTO,Toronto Hebrew Congregation / Holy Blossom Temple Preschool,,0.7323798,Below Threshold
Global Strides Charity,Peaceful Hearts Georgina Foundation,,0.59310055,Below Threshold
Israel's Peace Ministries,National Council of Jewish Women of Canada,,0.4835397,Below Threshold
St. Theresa's Parish,St. James the Apostle Anglican Church,,0.68911004,Below Threshold
13th Round Fight for Life,Royal Life Saving Society Canada,,0.4248258,Below Threshold
BETH JACOB VIANSHEI DRILDZ CONGREGATION,Gan Shalom Preschool (Op: Chabad On The Avenue),,0.6024161,Below Threshold
Environment Funders Canada / Financeurs en Environnement au Canada,Canadian Environmental Law Association,,0.67234296,Below Threshold
Sacred Logos Resource Centre (SAGOS) of Canada,Patronato INCA Canada,,0.54438156,Below Threshold
Our Lady of Sorrows Parish,Our Lady of Annunciation Catholic School Mobile,,0.64918673,Below Threshold
SCARBOROUGH BLUFFS UNITED CHURCH,Mount Albert United Church,,0.65279186,Below Threshold
"YORKMINSTER PARK BAPTIST CHURCH,",Maple Hill Baptist Church,,0.74167943,Below Threshold
"St. Alphonsa Syro Malabar Catholic Cathedral, Mississauga",St. James the Apostle Anglican Church,,0.64202523,Below Threshold
YORK ST. PETER'S EVANGELISTIC ORGANIZATION,St. James the Apostle Anglican Church,,0.6291424,Below Threshold
Chabad of Maple Inc.,Maple Hill Baptist Church,,0.56513894,Below Threshold
LOGOS BAPTIST CHURCH (JIREH),Redeemed Christian Church of God,,0.64505327,Below Threshold
The New Mom Project,Life With A Baby,,0.5635116,Below Threshold
UNION FOR REFORM JUDAISM CAMP GEORGE,Gan Shalom Day Camp,,0.5844846,Below Threshold
UKRAINIAN ORTHODOX CHURCH OF ST ANDREW THE APOSTLE,St. James the Apostle Anglican Church,,0.62138903,Below Threshold
Our Lady of Guadalupe Parish,Our Lady of Annunciation Catholic School Mobile,,0.6513472,Below Threshold
Sri Guru Ravidass Sabha Brampton (Canada),Brampton Life Centre,,0.6269815,Below Threshold
THE KOREAN EUN PYUNG CHURCH OF TORONTO,Cummer Avenue United Church and Taiwanese United Church,,0.6279505,Below Threshold
THE CANADIAN INSTITUTE OF CULTURAL AFFAIRS (ICA CANADA),Canadian Centre for Language and Cultural Studies,,0.7431621,Below Threshold
HOCKEY'S GREATEST FAMILY FUND/ LE FONDS DE LA GRANDE FAMILLEDU HOCKEY,Over Thirty Hockey League. Midland,,0.47548342,Below Threshold
"KOREAN-AMERICAN PRESBYTERIAN CHURCH, CANADA PRESBYTERY",Seventh-Day Adventist Church,,0.58470285,Below Threshold
YESHIVAH TORATH CHAIM,Torah Tots South,,0.64844155,Below Threshold
Association of Christian Evangelical Ministries (Canada),Redeemed Christian Church of God,,0.6724278,Below Threshold
THE ST. JOSEPH FAMILY OF COMPANIES FOUNDATION,St Demetrius Development Corporation,,0.5335639,Below Threshold
ST MARY'S CONFERENCE - BARRIE - CANADA,University of Toronto Students' Union,,0.57314825,Below Threshold
Faith Alive Christian Church of Barrie,Redeemed Christian Church of God,,0.64639187,Below Threshold
CATHOLIC YOUTH STUDIO - KSM INC.,St. Paul's Catholic Elementary School,,0.5789354,Below Threshold
THE CANADIAN FRIENDS OF EZRATH NASHIM HERZOG HOSPITAL,"University Health Network, Toronto Western Hospital",,0.60962886,Below Threshold
Anand Vihar - The Centre for Dignified Living,"Vasantham, A Tamil Wellness Centre",,0.5651798,Below Threshold
Trinity Church Port Credit Endowment Fund,Trinity Glen Housing Corporation,,0.5326749,Below Threshold
DHOKHAM CHUSHI GANGDRUG SOCIETY,Sai Dham Food Bank,,0.46477014,Below Threshold
TORONTO CHINESE CHRISTIAN SHORT-TERM MISSION TRAINING CENTRE,Canadian Training Institute,,0.6534652,Below Threshold
LA SEMENCE DE VIE,Le Petit Chaperon Rouge,,0.69341314,Below Threshold
CANADIAN FRIENDS OF RAMBAM MEDICAL CENTRE,Confederation Medical Centre,,0.6455358,Below Threshold
Peculiar Peoples Church,Redeemed Christian Church of God,,0.66354597,Below Threshold
POLISH NATIONAL CATHOLIC CHURCH OF CANADA,Caribbean Canadian Catholic Centre,,0.64665866,Below Threshold
HEBREW CENTRE OF JACKSON'S POINT,Torah Tots South,,0.56837595,Below Threshold
ESTONIAN BAPTIST CHURCH OF TORONTO,Maple Hill Baptist Church,,0.6424592,Below Threshold
YEDIDIM,Torah Tots South,,0.5687177,Below Threshold
Toronto Hanuri Presbyterian Church,Toronto Hebrew Congregation / Holy Blossom Temple Preschool,,0.6494827,Below Threshold
GOSPEL ECHOING MISSIONARY SOCIETY OF CANADA,Redeemed Christian Church of God,,0.68061185,Below Threshold
SHAAREI TEFILLAH CONGREGATION,Muslim Community Services,,0.6572629,Below Threshold
Prince of Peace Parish,Prince of Peace Children's Centre,,0.6466384,Below Threshold
SWAMINARAYAN MANDIR VASNA SANSTHA (SMVS) CANADA,"Vasantham, A Tamil Wellness Centre",,0.5291966,Below Threshold
"SMVS Swaminarayan Sanstha, Inc.",Vedic Roots Montessori Academy,,0.508327,Below Threshold
LIVE TO GIVE RELIEF ORGANIZATION,Royal Life Saving Society Canada,,0.5840852,Below Threshold
ITALIAN CANADIAN BENEVOLENT SENIORS APARTMENT CORPORATION,Canadian Italian Family Assistance Association,,0.7164649,Below Threshold
Project Aseret,Project Esperance,,0.5680997,Below Threshold
ST. THERESA'S WELL OF LIFE SPIRITUAL BAPTIST TABERNACLE,Redeemed Christian Church of God,,0.6940867,Below Threshold
The Simon Wood Foundation,St Simon's Shelter,,0.49692667,Below Threshold
Pashupatinath Nepali Canadian Culture Centre,Canadian Centre for Language and Cultural Studies,,0.6540619,Below Threshold
Vaughan Sarang Church,St. James the Apostle Anglican Church,,0.60908175,Below Threshold
St. Pius X Parish,St. Paul's Catholic Elementary School,,0.6063012,Below Threshold
St. Anselm's Parish,St. James the Apostle Anglican Church,,0.5684726,Below Threshold
Holy Rosary Parish,Carmelite Missionary Sisters of St Theresa Of Child Jesus,,0.6441714,Below Threshold
Nativity of Our Lord Parish,Redeemed Christian Church of God,,0.66842675,Below Threshold
St. Martin de Porres Parish,St Paschal Baylon,,0.6130337,Below Threshold
TRUTH TABERNACLE OF MARKHAM INC.,Markham. City of,,0.56987345,Below Threshold
ST. EDITH STEIN CHURCH,Mount Albert United Church,,0.59483695,Below Threshold
Seekers Christian Fellowship,Bethel Community Christian Reformed Church Share and Care,,0.66968864,Below Threshold
PIOUS SOCIETY OF ST. CHARLES BORROMEO OF ONTARIO,Ontario Historical Society,,0.62252283,Below Threshold
Toronto Christian Community Church,Caribbean Canadian Catholic Centre,,0.74854624,Below Threshold
Jampa Ling Kadampa Buddhist Centre,"Vasantham, A Tamil Wellness Centre",,0.56085676,Below Threshold
INTERNATIONAL REVIVAL MISSIONARY CHURCH,Redeemed Christian Church of God,,0.7260903,Below Threshold
THE BETH JOSEPH ANSHAI NEW YORK SYNAGOGUE,Gan Shalom Preschool (Op: Chabad On The Avenue),,0.6786616,Below Threshold
Senior Wish Association,"Integrated Partnerships for Seniors, (The)",,0.6432053,Below Threshold
Toronto Christian Fellowship,Friendship Circle of Toronto,,0.68736935,Below Threshold
PEACE KOREAN EVANGELICAL CHURCH,Redeemed Christian Church of God,,0.59926856,Below Threshold
St. Benedict's Parish,St. Benedict Child Care,,0.7112644,Below Threshold
RAJE (Canada),Canada. Members of Parliament,,0.5960624,Below Threshold
Global Brigades Health and Development,Alliance for Healthier Communities,,0.5262023,Below Threshold
WORD & LIFE CHRISTIAN ASSEMBLY,Bethel Community Christian Reformed Church Share and Care,,0.5742835,Below Threshold
ST. ANDREW'S JAPANESE CONGREGATION,Cummer Avenue United Church and Taiwanese United Church,,0.6050223,Below Threshold
LUN KWONG TEMPLE,Cummer Avenue United Church and Taiwanese United Church,,0.57547367,Below Threshold
Holiness Apostolic Tabernacle Inc.,Redeemed Christian Church of God,,0.7296528,Below Threshold
ST. RAPHAEL NIKOLAOS & IRENE GREEK EASTERN ORTHODOX CHURCH,St. James the Apostle Anglican Church,,0.66741395,Below Threshold
CONGREGATION SHOAVEI MAYIM,Ahmdiyya Muslim Youth Association,,0.5523032,Below Threshold
ABBEYFIELD HOUSES SOCIETY OF CALEDON,"Caledon, Town of",,0.6703228,Below Threshold
St. Gianna Beretta Molla Centre,Tuscany Medical Centre,,0.571764,Below Threshold
Dominion Ministries,Dale Ministries,,0.5671589,Below Threshold
CHRIST POWER MISSION,Redeemed Christian Church of God,,0.668784,Below Threshold
HIGH ADVENTURE GOSPEL COMMUNICATION MINISTRIES,Rhema Christian Ministries,,0.5377482,Below Threshold
CANADA JESUS FIRST CHURCH,Redeemed Christian Church of God,,0.7288054,Below Threshold
CHURCH OF ST.MARY AND ST.MARTHA,St Stephen's Community House,,0.6310403,Below Threshold
TAMIL COMMUNITY CHURCH,Senior Tamils' Centre,,0.74082375,Below Threshold
RIVER OF LIFE RESTORATION MINISTRIES INC.,Lake Simcoe Conservation Foundation,,0.5213125,Below Threshold
Tabernacle of Victory,Redeemed Christian Church of God,,0.62367725,Below Threshold
ARMEN ONTARIO OF ARMENIAN GENERAL BENEVOLENT UNION INC.,Armenian Relief Society Toronto Roubina Chapter,,0.65343785,Below Threshold
St. John's Parish,St. Jerome Catholic School Mobile,,0.6135534,Below Threshold
North York Fellowship International,Toronto Foundation for Student Success,,0.59180367,Below Threshold
TEACHING FOR LIFE MINISTRIES,Peoples Christian Academy Early Learning Centre,,0.5947814,Below Threshold
Liberty Grace Church,Liberty Preparatory School,,0.68537897,Below Threshold
Our Lady Queen of Croatia Parish,Our Lady of Smolensk,,0.5873678,Below Threshold
All Saints Parish,All Saints' Montessori School,,0.6818731,Below Threshold
Jesus King Of Glory Church,Redeemed Christian Church of God,,0.7041291,Below Threshold
FAIRVIEW CHURCH OF GOD,Maple Hill Baptist Church,,0.6645251,Below Threshold
ST. GEORGE GREEK ORTHODOX CHURCH,St. James the Apostle Anglican Church,,0.714275,Below Threshold
God's Vision Church,Redeemed Christian Church of God,,0.60305965,Below Threshold
Vedic Spiritual Heritage Foundation,Vedic Roots Montessori Academy,,0.696923,Below Threshold
CONGREGAZIONE PENTECOSTALE ITALIANA,Redeemed Christian Church of God,,0.62067354,Below Threshold
Thrive For Good,Growing Up Healthy Downtown,,0.40439856,Below Threshold
Changing Generations Youth Mentorship Program Inc.,For Youth Initiative,,0.6684911,Below Threshold
CANADIAN FRIENDS OF CHASIDEI BRESLOV,Friendship Circle of Toronto,,0.4831249,Below Threshold
Richmond Hill Russian Jewish Centre,Jewish Russian Community Centre Preschool and Day Care,,0.68004966,Below Threshold
"SRINGERI VIDYA BHARATI FOUNDATION, CANADA",Children's Aid Foundation of Canada,,0.56788266,Below Threshold
THE LIGHTHOUSE CHRISTIAN SOCIAL SERVICES,Light of Christ Child Care Centre,,0.64955544,Below Threshold
CHI SHIN TAO TEH TEMPLE,Cummer Avenue United Church and Taiwanese United Church,,0.5848459,Below Threshold
United We Stand Breakthrough Ministries,Dale Ministries,,0.47688377,Below Threshold
Dufresne Ministries Canada,Futurpreneur Canada,,0.5523051,Below Threshold
FIELD MINISTRIES INTERNATIONAL,International Medical Service,,0.48365474,Below Threshold
Eglise Evangelique Missionaire Des Assemblees De Dieu De Toronto,Lycee Francais De Toronto,,0.58599806,Below Threshold
TABERNACLE OF PRAISE,Redeemed Christian Church of God,,0.688193,Below Threshold
MISSIONGTA CHRISTIAN NETWORK,Redeemed Christian Church of God,,0.632208,Below Threshold
Assured Hope Ministry,Olive Branch of Hope (The),,0.6342295,Below Threshold
POLISH SCOUTING ASSOCIATION IN CANADA (ONTARIO) INC.,Ontario Camps Association,,0.59456444,Below Threshold
Fields of Harvest Church (FOHC),"Westminster Chapel at High Park Outreach Ministries, Food and Clothing Bank",,0.66739696,Below Threshold
National Zakat Foundation,North American Muslim Foundation,,0.51248026,Below Threshold
Uptown CYP,Uptown Health Centre,,0.5869669,Below Threshold
Thai Christian Church of Canada,Caribbean Canadian Catholic Centre,,0.6340873,Below Threshold
TAMIL CATHOLIC COMMUNITY OF TORONTO,Cypriot Community of Toronto,,0.6792587,Below Threshold
"STOUFFVILLE PASTORAL CHARGE,",Stouffville Creek Retirement Residence,,0.5836991,Below Threshold
Peel Islamic Cultural Center,Muslim Welfare Centre,,0.60135937,Below Threshold
Church on the Rock International Ministries,Redeemed Christian Church of God,,0.7086133,Below Threshold
ICEJ CANADA AID AND DEVELOPMENT,Outward Bound Canada. Charitable Programs,,0.6007522,Below Threshold
PARTNERS IN HARVEST (CANADA),Canada. Agriculture and Agri Food Canada,,0.5893519,Below Threshold
Hope Church Toronto West,Our Place Community of Hope Centre,,0.681023,Below Threshold
Mully Children's Family Canada,Family Service Canada,,0.6774802,Below Threshold
KING-BAY CHAPLAINCY,King. Township of,,0.5287082,Below Threshold
WILLOWDALE EVANGELICAL CHURCH/DEUTSCHE EVANGELISCHE MISSIONS-GEMEINDE,Redeemed Christian Church of God,,0.652053,Below Threshold
"SHRI GURU RAVIDASS SABHA, ONTARIO",Canadian Tibetan Association of Ontario,,0.56560504,Below Threshold
VAN HANH BUDDHIST ASSOCIATION (HOI PHAT GIAO VAN HANH) OF ONTARIO,Canadian Tibetan Association of Ontario,,0.6621512,Below Threshold
ST ANTHONY OF PADUA MISSION AID,Centro Abruzzo / Villa Charities,,0.60840905,Below Threshold
CANADIAN IMOTSKI COMMUNITY AND IMMIGRANT SERVICES OF ONTARIO,Immigration and Refugee Board of Canada. Central Region,,0.68272674,Below Threshold
Sanctuary of Love Ministries,Bethel Community Christian Reformed Church Share and Care,,0.6854334,Below Threshold
FOUNDATIONS FOR A NATION MINISTRY,North American Muslim Foundation,,0.49367929,Below Threshold
WEST TORONTO UNITED PENTECOSTAL CHURCH,Maple Hill Baptist Church,,0.6938977,Below Threshold
Mount Zion Gospel Church,Mount Albert United Church,,0.74608743,Below Threshold
Terra Bay Food Services Inc.,Specialty Food Shop,,0.58068585,Below Threshold
